{
  "$schema": "references/control-artifact.schema.json",
  "schema_version": "1.0",
  "kind": "measurement-contract",
  "artifact_id": "measurement-1",
  "created_at": "2026-08-01T09:00:00Z",
  "authoritative": false,
  "authority": "non-authoritative-operational-evidence",
  "registry_effect": false,
  "external_mutation_authorized": false,
  "payload": {
    "target": {
      "ref": "opaque:campaign-head-1",
      "sha256": "bbbbbbbbbbbbbbbbbbbbbbbbbbbbbbbbbbbbbbbbbbbbbbbbbbbbbbbbbbbbbbbb",
      "version": "campaign-v3"
    },
    "contract_version": "contract-v1",
    "population_ref": "opaque:population-snapshot-1",
    "scope_ref": "opaque:campaign-scope-1",
    "analysis_unit": "campaign",
    "counterfactual_type": "holdout",
    "control": {
      "ref": "opaque:control-1",
      "sha256": "cccccccccccccccccccccccccccccccccccccccccccccccccccccccccccccccc",
      "version": "campaign-v2"
    },
    "candidate": {
      "ref": "opaque:campaign-head-1",
      "sha256": "bbbbbbbbbbbbbbbbbbbbbbbbbbbbbbbbbbbbbbbbbbbbbbbbbbbbbbbbbbbbbbbb",
      "version": "campaign-v3"
    },
    "primary_metric": {
      "metric_id": "conversion_rate",
      "unit": "ratio",
      "direction": "increase",
      "truth_source_ref": "opaque:warehouse-view-1",
      "attribution_rule_ref": "opaque:attribution-rule-1",
      "conversion_lag_ref": "opaque:lag-7d"
    },
    "guardrail_metric_ids": ["unsubscribe_rate"],
    "start_at": "2026-08-02T00:00:00Z",
    "stop_at": "2026-08-09T00:00:00Z",
    "read_at": "2026-08-16T00:00:00Z",
    "decision_rule_ref": "opaque:decision-rule-1",
    "decision_owner_ref": "opaque:decision-owner-1",
    "locked_at": "2026-08-01T08:00:00Z",
    "exploratory": false
  }
}
