{
  "$schema": "references/control-artifact.schema.json",
  "schema_version": "1.0",
  "kind": "evidence-observation",
  "artifact_id": "evidence-before",
  "created_at": "2026-08-01T12:00:00Z",
  "authoritative": false,
  "authority": "non-authoritative-operational-evidence",
  "registry_effect": false,
  "external_mutation_authorized": false,
  "payload": {
    "target": {
      "ref": "opaque:campaign-head-1",
      "sha256": "bbbbbbbbbbbbbbbbbbbbbbbbbbbbbbbbbbbbbbbbbbbbbbbbbbbbbbbbbbbbbbbb",
      "version": "campaign-v2"
    },
    "observation_window": {
      "start_at": "2026-07-01T00:00:00Z",
      "end_at": "2026-07-31T23:59:59Z"
    },
    "fields": [
      {
        "field_id": "conversion_rate",
        "state": "observed",
        "sources": [],
        "value_ref": {
          "ref": "memory/control/values/conversion_rate_before.json",
          "sha256": "1212121212121212121212121212121212121212121212121212121212121212",
          "version": "v1"
        },
        "freshness": "current",
        "missing_reason": null,
        "conflict_group": null
      }
    ],
    "readiness": "ready",
    "unresolved_conflicts": []
  }
}
